index,title,subtitle,category,price,origin_price,unit,vintage,abv,volume,main,nose,palate,finish
33,德國猴子47琴酒,Monkey 47 Dry Gin,"琴酒, 德國",1288,1610,瓶,,47.0,500mL,"來自德國黑森林的一種不尋常的琴酒，含有眾多獨特的成分，其中最獨特的成分就是蔓越莓。47 來自於進入這種獨特琴酒的植物使用的數量，以及它以 47％ 的酒精度裝瓶。
這整支酒採全手工製作，使用天然的軟質山泉水和豐富的異國香料，浸泡在法國糖蜜製成的烈酒中 36 個小時 。喝起來有著複雜的草本、花香、柑橘及辛香料味道，清新宜人。",木質的香氣，蔬菜的味道還帶有柑橘味和植物的甜味，如雨後的松樹林,複雜且強勁而有力的琴酒酒，含有大量的香料，水果和香草味。結構非常好，新鮮柑橘甜與松木和木材融合,雄厚且濃烈的木質餘味
34,蘇格蘭亨利爵士琴酒,Hendricks Gin,"琴酒, 蘇格蘭",1099,1364,瓶,,41.4,1L,獨特的香氛與氣味「亨利爵士」琴酒，蘊含濃郁迷人的植物香味，與杜松子，小黃瓜，胡萎絕妙合諧，並將紫羅蘭和玫瑰花瓣的香氛層層封存，形成入喉滑順，完美搭配植物清香的絕妙口感；啜飲品嚐之後，迭有複雜的氣味延伸，淡淡地柑橘和杜松子味，透著細緻清爽的小黃瓜和玫瑰香氣在口中四溢。,蘊含濃郁迷人的植物香味，與杜松子，小黃瓜，胡萎絕妙合諧，並將紫羅蘭和玫瑰花瓣的香氛層層封存,蘊含濃郁迷人的植物香味，與杜松子，小黃瓜，胡萎絕妙合諧，並將紫羅蘭和玫瑰花瓣的香氛層層封存,品後迭有複雜的氣味延伸，淡淡地柑橘和杜松子味，透著細緻清爽的小黃瓜和玫瑰香氣在口中四溢
35,美國科沃琴酒,Koval Dry Gin,"琴酒, 美國",1690,1800,瓶,,47.0,750mL,品嘗過 Koval Dry Gin 的人們，將從桶陳琴酒中得到相似的味道和口感——薔薇果、杜松子、白芷根和芫荽的清爽與輕快。但在 Dry Gin 已有的釀造工序之上，Koval 將其放入橡木桶中，讓金柑橘與其他香料混入更多層次的味道，增添些許奶油硬糖的甜美，香料與橡木的完美融合成就了 Koval 獨特的桶陳琴酒。「穀物原味裝瓶」的理念和對細節的極致追求在最終的產品中充分展現出來，這款獨特的烈酒讓琴酒和威士忌的愛好者都嘖嘖稱奇。,蘊含濃郁迷人的植物香味，與杜松子，小黃瓜，胡萎絕妙合諧，並將紫羅蘭和玫瑰花瓣的香氛層層封存,蘊含濃郁迷人的植物香味，與杜松子，小黃瓜，胡萎絕妙合諧，並將紫羅蘭和玫瑰花瓣的香氛層層封存,品後迭有複雜的氣味延伸，淡淡地柑橘和杜松子味，透著細緻清爽的小黃瓜和玫瑰香氣在口中四溢
36,日本六琴酒,Roku Gin,"琴酒, 日本",799,880,瓶,,43.0,700mL,六 (ROKU) 是琴酒工藝師純熟精確掌握各種原料，以及專注在製程上的細節所誕生的頂級琴酒。六 (ROKU) 使用了 6 種經典的日本植物：櫻花、櫻花葉、日本柚子皮、煎茶、玉露，日本山椒；這些植物都是順應四季時序，在植物最盛開的時候採收並擷取其中的精華及香氣，經過日本大阪三得利烈酒廠的日本琴酒工藝師浸製、蒸餾、最後調和而成。,櫻花和綠茶帶來花香和甜美的香氣,各種植物的複雜，多樣層次和諧的味道。基調的傳統琴酒口味，加上特色的日本植物香調，以柚子為首選,清爽的日本胡椒帶來一點點辛香的收尾
37,蘇格蘭 植物學家琴酒,The Botanist Gin,"琴酒, 蘇格蘭",1099,1350,瓶,,46.0,700mL,植物學家琴酒是獨一無二的艾雷島乾琴酒。不添加任何香精，只透過 22 種手工採集的艾雷島當地植物，與 9 種琴酒專用植物，將這些果實、樹皮、種子與果皮，以目前世上唯一的羅夢式蒸餾器低壓文火緩慢蒸餾，讓清澈純淨的酒液緩慢地萃取天然原生的植物精華，保留細緻的芳香。調製以琴酒為基底的經典調酒時，能夠保留經典風味，又能帶出一縷植物的清雅變幻。,淡淡杜松子，檸檬皮，柚子皮香氣，一種複合式精油的感覺,十分溫潤完全沒有高酒精度的刺激，草本植物香氣及溫和醇厚的酒體，在嘴裡隨著口水及體溫緩緩綻放，毫不突兀十分舒服，在嘴裡有一絲絲泥煤氣味不知是否試過多聯想,悠長芬芳的草本香氣及類似甘草薄荷糖的甜味
38,法國絲塔朵琴酒,Citadelle Gin,"琴酒, 法國",1100,1200,瓶,,44.0,700mL,法國杜松子、鳶尾根、紫羅蘭，摩洛哥芫荽子、杏仁，西班牙檸檬皮，墨西哥橘皮，德國北部的歐白芷根，印度小荳蔻、肉荳蔻，印尼桂皮，斯里蘭卡肉桂，地中海八角茴香，非洲天堂椒，爪哇的蓽澄茄，中國甘草、小茴香，法國大茴香、香薄荷。使用多達19種來自世界各地手工採收的新鮮草本辛香料，72 小時長時間低溫浸泡在三次蒸餾的小麥蒸餾液中，將草本精華與香氣完全萃取，讓主體的杜松子氣息更加立體柔和，也增添複雜層次。,紫羅蘭、甜橙與明亮清爽的芫荽子，接著些許的花卉及肉荳蔻、肉桂等各式辛香料散發,新鮮清脆的杜松子，伴隨著小荳蔻、歐白芷香氣在口中繚繞，甘草、肉荳蔻與茴香的尾韻溫暖包覆,柔順易飲
39,瑞典 PURITY 34 海軍強度琴酒,Purity 34 Craft Nordic Navy Strength Organic Gin,"琴酒, 瑞典",1299,1400,瓶,,57.1,700mL,Purity 用更好、更大膽的成份去更新經典配方，Nordic Dry Gin 被描述為杜松的盛宴。使用杜松、香菜、薰衣草、荳蔻、當歸、羅勒、百里香、越橘和歐洲藍莓等植物藥草。添加了有機糖，產生了一種帶有略微柔和甜感的烈酒，並散發出花香。它被形容為令人振奮且風味濃郁的醒目酒款。,樹脂苦味、杜松、甜果香、香草、及一絲羅勒氣味,強勁的羅勒、杜松樹脂、香草、漿果、當歸根、香菜、荳蔻的香氣,綿延悠長
40,瑞典 PURITY 34 老湯姆琴酒,Purity 34 Craft Nordic Old Tom Organic Gin,"琴酒, 瑞典",1299,1400,瓶,,43.0,700mL,Purity 用更好、更大膽的成份去更新經典配方，Nordic Dry Gin 被描述為杜松的盛宴。使用杜松、香菜、薰衣草、荳蔻、當歸、羅勒、百里香、越橘和歐洲藍莓等植物藥草。添加了有機糖，產生了一種帶有略微柔和甜感的烈酒，並散發出花香。它被形容為令人振奮且風味濃郁的醒目酒款。,樹脂苦味、杜松、甜果香、香草、及一絲羅勒氣味,強勁的羅勒、杜松樹脂、香草、漿果、當歸根、香菜、荳蔻的香氣,綿延悠長
41,瑞典 PURITY 34 乾琴酒,Purity 34 Craft Nordic Dry Organic Gin,"琴酒, 瑞典",1299,1400,瓶,,43.0,700mL,Purity 用更好、更大膽的成份去更新經典配方，Nordic Dry Gin 被描述為杜松的盛宴。使用杜松、香菜、薰衣草、荳蔻、當歸、羅勒、百里香、越橘和歐洲藍莓等植物藥草。添加了有機糖，產生了一種帶有略微柔和甜感的烈酒，並散發出花香。它被形容為令人振奮且風味濃郁的醒目酒款。,樹脂苦味、杜松、甜果香、香草、及一絲羅勒氣味,強勁的羅勒、杜松樹脂、香草、漿果、當歸根、香菜、荳蔻的香氣,綿延悠長